File,SentenceNumber,Sentence,Translation,TimeStamp,author,raw,authorEmoji,textEmoji,authorNon,textNon
C_1,0,"‎28 / 04 / 18 , 14 : 18 - Bullo2 : Vaffanculo Vittima nessuno vuole fare i compiti","‎28 / 04 / 18 , 14 : 18 - Bullo2 : Fuck off Vittima, no one wants to do homework","28 / 04 / 18 , 14 : 18", - Bullo2 ," Fuck off Vittima, no one wants to do homework",- Bullo2,"Fuck off Vittima, no one wants to do homework",- Bullo2,"Fuck off Vittima, no one wants to do homework"
C_1,1,"‎28 / 04 / 18 , 14 : 19 - SupportoBullo3 : Infatti ma stai zitto e non studiare sempre bravo Bullo2 così si fai","‎28 / 04 / 18 , 14 : 19 - SupportoBullo3 : In fact, shut up and do not study all the time , good Bullo2, there you go","28 / 04 / 18 , 14 : 19", - SupportoBullo3 ," In fact, shut up and do not study all the time , good Bullo2, there you go",- SupportoBullo3,"In fact, shut up and do not study all the time , good Bullo2, there you go",- SupportoBullo3,"In fact, shut up and do not study all the time , good Bullo2, there you go"
C_1,2,"‎28 / 04 / 18 , 14 : 19 - SupportoBullo1 : Quasi quasi verrei lì da te e te li farei fare tutti i nostri compiti in più crepa","‎28 / 04 / 18 , 14 : 19 - SupportoBullo1 : I almost would come to you and I would make you do all our extra homework. Die.","28 / 04 / 18 , 14 : 19", - SupportoBullo1 , I almost would come to you and I would make you do all our extra homework. Die.,- SupportoBullo1,I almost would come to you and I would make you do all our extra homework. Die.,- SupportoBullo1,I almost would come to you and I would make you do all our extra homework. Die.
C_1,3,"‎28 / 04 / 18 , 14 : 20 - SupportoBullo3 : Ecco secchione da schifo","‎28 / 04 / 18 , 14 : 20 - SupportoBullo3 : Here's shitty nerd.","28 / 04 / 18 , 14 : 20", - SupportoBullo3 , Here's shitty nerd.,- SupportoBullo3,Here's shitty nerd.,- SupportoBullo3,Here's shitty nerd.
C_1,4,"‎28 / 04 / 18 , 14 : 20 - SupportoVittima1 : Ogniuno si deve fare i propti compiti pk cosí si impara qualcosa","‎28 / 04 / 18 , 14 : 20 - SupportoVittima1 : Everyone has to do their homework, because that is how they can learn something.","28 / 04 / 18 , 14 : 20", - SupportoVittima1 ," Everyone has to do their homework, because that is how they can learn something.",- SupportoVittima1,"Everyone has to do their homework, because that is how they can learn something.",- SupportoVittima1,"Everyone has to do their homework, because that is how they can learn something."
C_1,5,"‎28 / 04 / 18 , 14 : 20 - Bullo2 : MinChia pure tua madre se mi sta sul c***o","‎28 / 04 / 18 , 14 : 20 - Bullo2 : F**k your mother too, if she's on my ass!","28 / 04 / 18 , 14 : 20", - Bullo2 ," F**k your mother too, if she's on my ass!",- Bullo2,"F**k your mother too, if she's on my ass!",- Bullo2,"F**k your mother too, if she's on my ass!"
C_1,6,"‎28 / 04 / 18 , 14 : 21 - SupportoBullo1 : Tutta colpa tua ora non ho mai tempo libero solo perché devo fare sto cazzo di compiti che per colpa tua facciamo","‎28 / 04 / 18 , 14 : 21 - SupportoBullo1 : It is all your fault now,  I never have free time just because I have to do this f***ing homework that we do because of you","28 / 04 / 18 , 14 : 21", - SupportoBullo1 ," It is all your fault now,  I never have free time just because I have to do this f***ing homework that we do because of you",- SupportoBullo1,"It is all your fault now, I never have free time just because I have to do this f***ing homework that we do because of you",- SupportoBullo1,"It is all your fault now, I never have free time just because I have to do this f***ing homework that we do because of you"
C_1,7,"‎28 / 04 / 18 , 14 : 21 - SupportoBullo3 : Si ma non si può star a casa tutto il giorno a studiare si deve essere così stupidi","‎28 / 04 / 18 , 14 : 21 - SupportoBullo3 : yeah but you can't stay home all day and study, you must be so stupid","28 / 04 / 18 , 14 : 21", - SupportoBullo3 ," yeah but you can't stay home all day and study, you must be so stupid",- SupportoBullo3,"yeah but you can't stay home all day and study, you must be so stupid",- SupportoBullo3,"yeah but you can't stay home all day and study, you must be so stupid"
C_1,8,"‎28 / 04 / 18 , 14 : 21 - SupportoBullo1 : Non poteva starsene zitta poi","‎28 / 04 / 18 , 14 : 21 - SupportoBullo1 : She could not stay silent then","28 / 04 / 18 , 14 : 21", - SupportoBullo1 , She could not stay silent then,- SupportoBullo1,She could not stay silent then,- SupportoBullo1,She could not stay silent then
C_1,9,"‎28 / 04 / 18 , 14 : 22 - Bullo2 : I libri dei compiti te li infiliamo su per il . . .","‎28 / 04 / 18 , 14 : 22 - Bullo2 : We'll shove your homework books up your...","28 / 04 / 18 , 14 : 22", - Bullo2 , We'll shove your homework books up your...,- Bullo2,We'll shove your homework books up your...,- Bullo2,We'll shove your homework books up your...
C_1,10,"‎28 / 04 / 18 , 14 : 22 - SupportoVittima1 : Poi non rompete a Vittima pk si vede che lui studia e coi no","‎28 / 04 / 18 , 14 : 22 - SupportoVittima1 : Then don't bother Vittima because it is clear that he studies and you don't","28 / 04 / 18 , 14 : 22", - SupportoVittima1 , Then don't bother Vittima because it is clear that he studies and you don't,- SupportoVittima1,Then don't bother Vittima because it is clear that he studies and you don't,- SupportoVittima1,Then don't bother Vittima because it is clear that he studies and you don't
C_1,11,"‎28 / 04 / 18 , 14 : 22 - Bullo2 : Ma che casso c'è ne frega che lui studia e noi no Mona","‎28 / 04 / 18 , 14 : 22 - Bullo2 : What the hell do we care if he studies and we don't, bitch?","28 / 04 / 18 , 14 : 22", - Bullo2 ," What the hell do we care if he studies and we don't, bitch?",- Bullo2,"What the hell do we care if he studies and we don't, bitch?",- Bullo2,"What the hell do we care if he studies and we don't, bitch?"
C_1,12,"‎28 / 04 / 18 , 14 : 23 - SupportoBullo3 : Ma stai zitta tu e il tuo fidanzato che studia","‎28 / 04 / 18 , 14 : 23 - SupportoBullo3 : Shut up, you and your boyfriend who studies","28 / 04 / 18 , 14 : 23", - SupportoBullo3 ," Shut up, you and your boyfriend who studies",- SupportoBullo3,"Shut up, you and your boyfriend who studies",- SupportoBullo3,"Shut up, you and your boyfriend who studies"
C_1,13,"‎28 / 04 / 18 , 14 : 23 - Bullo2 : Vittima coglione","‎28 / 04 / 18 , 14 : 23 - Bullo2 : Vittima asshole","28 / 04 / 18 , 14 : 23", - Bullo2 , Vittima asshole,- Bullo2,Vittima asshole,- Bullo2,Vittima asshole
C_1,14,"‎28 / 04 / 18 , 14 : 23 - SupportoBullo3 : Hahahahah hai ragione","‎28 / 04 / 18 , 14 : 23 - SupportoBullo3 : Hahahah you are right","28 / 04 / 18 , 14 : 23", - SupportoBullo3 , Hahahah you are right,- SupportoBullo3,Hahahah you are right,- SupportoBullo3,Hahahah you are right
C_1,15,"‎28 / 04 / 18 , 14 : 24 - Vittima : ma non è colpa mia !","‎28 / 04 / 18 , 14 : 24 - Vittima : But it's not my fault!","28 / 04 / 18 , 14 : 24", - Vittima , But it's not my fault!,- Vittima,But it's not my fault!,- Vittima,But it's not my fault!
C_1,16,"‎28 / 04 / 18 , 14 : 24 - Vittima : perché ve la prendete con me","‎28 / 04 / 18 , 14 : 24 - Vittima : Why are you targeting me?","28 / 04 / 18 , 14 : 24", - Vittima , Why are you targeting me?,- Vittima,Why are you targeting me?,- Vittima,Why are you targeting me?
C_1,17,"‎28 / 04 / 18 , 14 : 24 - Bullo2 : No è di chi","‎28 / 04 / 18 , 14 : 24 - Bullo2 : No it's whose","28 / 04 / 18 , 14 : 24", - Bullo2 , No it's whose,- Bullo2,No it's whose,- Bullo2,No it's whose
C_1,18,"‎28 / 04 / 18 , 14 : 24 - Vittima : è stata mia madre","‎28 / 04 / 18 , 14 : 24 - Vittima : it was my mother","28 / 04 / 18 , 14 : 24", - Vittima , it was my mother,- Vittima,it was my mother,- Vittima,it was my mother
C_1,19,"‎28 / 04 / 18 , 14 : 24 - SupportoVittima1 : 1 cosa NON é il mio fidanzato","‎28 / 04 / 18 , 14 : 24 - SupportoVittima1 : First thing he is not my boyfriend","28 / 04 / 18 , 14 : 24", - SupportoVittima1 , First thing he is not my boyfriend,- SupportoVittima1,First thing he is not my boyfriend,- SupportoVittima1,First thing he is not my boyfriend
C_1,20,"‎28 / 04 / 18 , 14 : 24 - Vittima : ma io non ho fatto niente","‎28 / 04 / 18 , 14 : 24 - Vittima : but I have not done anything","28 / 04 / 18 , 14 : 24", - Vittima , but I have not done anything,- Vittima,but I have not done anything,- Vittima,but I have not done anything
C_1,21,"‎28 / 04 / 18 , 14 : 24 - Bullo2 : Tua madre fa schifo quanto te","‎28 / 04 / 18 , 14 : 24 - Bullo2 : Your mother sucks as much as you do","28 / 04 / 18 , 14 : 24", - Bullo2 , Your mother sucks as much as you do,- Bullo2,Your mother sucks as much as you do,- Bullo2,Your mother sucks as much as you do
C_1,22,"‎28 / 04 / 18 , 14 : 25 - Vittima : non offendere mia madre","‎28 / 04 / 18 , 14 : 25 - Vittima : do not offend my mother","28 / 04 / 18 , 14 : 25", - Vittima , do not offend my mother,- Vittima,do not offend my mother,- Vittima,do not offend my mother
C_1,23,"‎28 / 04 / 18 , 14 : 25 - SupportoBullo3 : Hahahaha che bacia ancora con la mamma chiamiamo l'ambulagna","‎28 / 04 / 18 , 14 : 25 - SupportoBullo3 : Hahaha still kissing with mom, let's call the ambulance","28 / 04 / 18 , 14 : 25", - SupportoBullo3 ," Hahaha still kissing with mom, let's call the ambulance",- SupportoBullo3,"Hahaha still kissing with mom, let's call the ambulance",- SupportoBullo3,"Hahaha still kissing with mom, let's call the ambulance"
C_1,24,"‎28 / 04 / 18 , 14 : 25 - Bullo2 : Sempre li a studiare stai ma fatti una vita cazzo","‎28 / 04 / 18 , 14 : 25 - Bullo2 : You're always studying, but live a f***ing life.","28 / 04 / 18 , 14 : 25", - Bullo2 ," You're always studying, but live a f***ing life.",- Bullo2,"You're always studying, but live a f***ing life.",- Bullo2,"You're always studying, but live a f***ing life."
C_1,25,"‎28 / 04 / 18 , 14 : 25 - SupportoVittima1 : Lo volete ccapire che non é colpa sua ma di sua madre","‎28 / 04 / 18 , 14 : 25 - SupportoVittima1 : Do you understand that it's not his fault, it's his mother's fault.","28 / 04 / 18 , 14 : 25", - SupportoVittima1 ," Do you understand that it's not his fault, it's his mother's fault.",- SupportoVittima1,"Do you understand that it's not his fault, it's his mother's fault.",- SupportoVittima1,"Do you understand that it's not his fault, it's his mother's fault."
C_1,26,"‎28 / 04 / 18 , 14 : 25 - Vittima : ma cosa vuoi tu","‎28 / 04 / 18 , 14 : 25 - Vittima : What do you want","28 / 04 / 18 , 14 : 25", - Vittima , What do you want,- Vittima,What do you want,- Vittima,What do you want
C_1,27,"‎28 / 04 / 18 , 14 : 25 - Vittima : a me piace studiare","28 / 04 / 18 , 14 : 25 - Vittima : I like to study","28 / 04 / 18 , 14 : 25", - Vittima , I like to study,- Vittima,I like to study,- Vittima,I like to study
C_1,28,"‎28 / 04 / 18 , 14 : 25 - Bullo2 : Io offendo chi voglio","‎28 / 04 / 18 , 14 : 25 - Bullo2 : I offend whoever I want","28 / 04 / 18 , 14 : 25", - Bullo2 , I offend whoever I want,- Bullo2,I offend whoever I want,- Bullo2,I offend whoever I want
C_1,29,"‎28 / 04 / 18 , 14 : 25 - Bullo2 : Studia studia poi tanto da grande pulirai i cessi","‎28 / 04 / 18 , 14 : 25 - Bullo2 : Study, study. When you grow up you'll be cleaning toilets anyway.","28 / 04 / 18 , 14 : 25", - Bullo2 ," Study, study. When you grow up you'll be cleaning toilets anyway.",- Bullo2,"Study, study. When you grow up you'll be cleaning toilets anyway.",- Bullo2,"Study, study. When you grow up you'll be cleaning toilets anyway."
C_1,30,"‎28 / 04 / 18 , 14 : 25 - Vittima : magari vi fa bene studiare un po'","‎28 / 04 / 18 , 14 : 25 - Vittima : Maybe it's good for you to study a little.","28 / 04 / 18 , 14 : 25", - Vittima , Maybe it's good for you to study a little.,- Vittima,Maybe it's good for you to study a little.,- Vittima,Maybe it's good for you to study a little.
C_1,31,"‎28 / 04 / 18 , 14 : 26 - Vittima : visto che non mi sembra siate bravissimi","‎28 / 04 / 18 , 14 : 26 - Vittima : since you don't seem to be very good at it","28 / 04 / 18 , 14 : 26", - Vittima , since you don't seem to be very good at it,- Vittima,since you don't seem to be very good at it,- Vittima,since you don't seem to be very good at it
C_1,32,"‎28 / 04 / 18 , 14 : 26 - Vittima : non è vero","‎28 / 04 / 18 , 14 : 26 - Vittima : It's not true.","28 / 04 / 18 , 14 : 26", - Vittima , It's not true.,- Vittima,It's not true.,- Vittima,It's not true.
C_1,33,"‎28 / 04 / 18 , 14 : 26 - Vittima : lo dico alla prof che mi offendi","‎28 / 04 / 18 , 14 : 26 - Vittima : I'll tell the teacher that you offend me.","28 / 04 / 18 , 14 : 26", - Vittima , I'll tell the teacher that you offend me.,- Vittima,I'll tell the teacher that you offend me.,- Vittima,I'll tell the teacher that you offend me.
C_1,34,"‎28 / 04 / 18 , 14 : 26 - Bullo2 : Diglielo","‎28 / 04 / 18 , 14 : 26 - Bullo2 : Tell him","28 / 04 / 18 , 14 : 26", - Bullo2 , Tell him,- Bullo2,Tell him,- Bullo2,Tell him
C_1,35,"‎28 / 04 / 18 , 14 : 26 - Vittima : dopo voglio vedee","‎28 / 04 / 18 , 14 : 26 - Vittima : I want to see then","28 / 04 / 18 , 14 : 26", - Vittima , I want to see then,- Vittima,I want to see then,- Vittima,I want to see then
C_1,36,"‎28 / 04 / 18 , 14 : 26 - SupportoBullo3 : Ma che testa di cazzo come tua madre","‎28 / 04 / 18 , 14 : 26 - SupportoBullo3 : What a dickhead, like your mother.","28 / 04 / 18 , 14 : 26", - SupportoBullo3 ," What a dickhead, like your mother.",- SupportoBullo3,"What a dickhead, like your mother.",- SupportoBullo3,"What a dickhead, like your mother."
C_1,37,"‎28 / 04 / 18 , 14 : 26 - SupportoVittima1 : No carino quello é il tuo lavoro se non inizi a studiare un pò","‎28 / 04 / 18 , 14 : 26 - SupportoVittima1 : That's your job, dear, if you don't start studying.","28 / 04 / 18 , 14 : 26", - SupportoVittima1 ," That's your job, dear, if you don't start studying.",- SupportoVittima1,"That's your job, dear, if you don't start studying.",- SupportoVittima1,"That's your job, dear, if you don't start studying."
C_1,38,"‎28 / 04 / 18 , 14 : 27 - Bullo2 : Raga sto qua e già tanto che ha WhatsApp &#129315; &#129315; coglione quanto lo puoi usare il telefono al giorno due minuti ?","‎28 / 04 / 18 , 14 : 27 - Bullo2 :  Guys, it is a wonder that this chap has WhatsApp &#129315; &#129315; asshole how long  can you use the phone per day -  two minutes?","28 / 04 / 18 , 14 : 27", - Bullo2 ,"  Guys, it is a wonder that this chap has WhatsApp &#129315; &#129315; asshole how long  can you use the phone per day -  two minutes?",- Bullo2,"Guys, it is a wonder that this chap has WhatsApp 🤣 🤣 asshole how long can you use the phone per day - two minutes?",- Bullo2,"Guys, it is a wonder that this chap has WhatsApp   asshole how long can you use the phone per day - two minutes?"
C_1,39,"‎28 / 04 / 18 , 14 : 27 - SupportoBullo3 : Ma stai zitta SupportoVittima1 che tu lavorerai tu ai cessi come te","‎28 / 04 / 18 , 14 : 27 - SupportoBullo3 : Shut up SupportoVittima1 you will work in the toilets like you","28 / 04 / 18 , 14 : 27", - SupportoBullo3 , Shut up SupportoVittima1 you will work in the toilets like you,- SupportoBullo3,Shut up SupportoVittima1 you will work in the toilets like you,- SupportoBullo3,Shut up SupportoVittima1 you will work in the toilets like you
C_1,40,"‎28 / 04 / 18 , 14 : 27 - SupportoBullo3 : Hahahah hai ragione","‎28 / 04 / 18 , 14 : 27 - SupportoBullo3 : Hahahah you are right","28 / 04 / 18 , 14 : 27", - SupportoBullo3 , Hahahah you are right,- SupportoBullo3,Hahahah you are right,- SupportoBullo3,Hahahah you are right
C_1,41,"‎28 / 04 / 18 , 14 : 27 - Bullo2 : Grande SupportoBullo3","‎28 / 04 / 18 , 14 : 27 - Bullo2 : Great SupportoBullo3","28 / 04 / 18 , 14 : 27", - Bullo2 , Great SupportoBullo3,- Bullo2,Great SupportoBullo3,- Bullo2,Great SupportoBullo3
C_1,42,"‎28 / 04 / 18 , 14 : 28 - Vittima : io non lo uso spesso perché devo studiare . . . ma non ho regole","‎28 / 04 / 18 , 14 : 28 - Vittima : I don't use it often because I have to study. . . but I have no rules","28 / 04 / 18 , 14 : 28", - Vittima , I don't use it often because I have to study. . . but I have no rules,- Vittima,I don't use it often because I have to study. . . but I have no rules,- Vittima,I don't use it often because I have to study. . . but I have no rules
C_1,43,"‎28 / 04 / 18 , 14 : 28 - Bullo2 : Ma stai zitta mona","‎28 / 04 / 18 , 14 : 28 - Bullo2 : shut up bitch","28 / 04 / 18 , 14 : 28", - Bullo2 , shut up bitch,- Bullo2,shut up bitch,- Bullo2,shut up bitch
C_1,44,"‎28 / 04 / 18 , 14 : 28 - Vittima : mica sono un bambino","‎28 / 04 / 18 , 14 : 28 - Vittima : I am not a child","28 / 04 / 18 , 14 : 28", - Vittima , I am not a child,- Vittima,I am not a child,- Vittima,I am not a child
C_1,45,"‎28 / 04 / 18 , 14 : 28 - SupportoVittima1 : Ma dai che qui sei te il cesso","‎28 / 04 / 18 , 14 : 28 - SupportoVittima1 : Come on, you're the shit here.","28 / 04 / 18 , 14 : 28", - SupportoVittima1 ," Come on, you're the shit here.",- SupportoVittima1,"Come on, you're the shit here.",- SupportoVittima1,"Come on, you're the shit here."
C_1,46,"‎28 / 04 / 18 , 14 : 28 - Bullo2 : Appunto","‎28 / 04 / 18 , 14 : 28 - Bullo2 : Exactly","28 / 04 / 18 , 14 : 28", - Bullo2 , Exactly,- Bullo2,Exactly,- Bullo2,Exactly
C_1,47,"‎28 / 04 / 18 , 14 : 28 - Bullo2 : Questo è ritardato","‎28 / 04 / 18 , 14 : 28 - Bullo2 : This one is retarded","28 / 04 / 18 , 14 : 28", - Bullo2 , This one is retarded,- Bullo2,This one is retarded,- Bullo2,This one is retarded
C_1,48,"‎28 / 04 / 18 , 14 : 28 - SupportoVittima1 : Ok","‎28 / 04 / 18 , 14 : 28 - SupportoVittima1 : Ok","28 / 04 / 18 , 14 : 28", - SupportoVittima1 , Ok,- SupportoVittima1,Ok,- SupportoVittima1,Ok
C_1,49,"‎28 / 04 / 18 , 14 : 28 - SupportoBullo3 : Si sì tu sei un bimbo minchia come la tua ragazza SupportoVittima1","‎28 / 04 / 18 , 14 : 28 - SupportoBullo3 : Yes, you are a f***ing kid like your girlfriend SupportoVittima1","28 / 04 / 18 , 14 : 28", - SupportoBullo3 ," Yes, you are a f***ing kid like your girlfriend SupportoVittima1",- SupportoBullo3,"Yes, you are a f***ing kid like your girlfriend SupportoVittima1",- SupportoBullo3,"Yes, you are a f***ing kid like your girlfriend SupportoVittima1"
C_1,50,"‎28 / 04 / 18 , 14 : 28 - Bullo2 : Perfetto","‎28 / 04 / 18 , 14 : 28 - Bullo2 : Perfect","28 / 04 / 18 , 14 : 28", - Bullo2 , Perfect,- Bullo2,Perfect,- Bullo2,Perfect
C_1,51,"‎28 / 04 / 18 , 14 : 29 - SupportoBullo3 : Ok","‎28 / 04 / 18 , 14 : 29 - SupportoBullo3 : Ok","28 / 04 / 18 , 14 : 29", - SupportoBullo3 , Ok,- SupportoBullo3,Ok,- SupportoBullo3,Ok
C_1,52,"‎28 / 04 / 18 , 14 : 29 - SupportoBullo3 : Perfetto scusa SupportoVittima1","‎28 / 04 / 18 , 14 : 29 - SupportoBullo3 : Perfect, sorry SupportoVittima1","28 / 04 / 18 , 14 : 29", - SupportoBullo3 ," Perfect, sorry SupportoVittima1",- SupportoBullo3,"Perfect, sorry SupportoVittima1",- SupportoBullo3,"Perfect, sorry SupportoVittima1"
C_1,53,"‎28 / 04 / 18 , 14 : 29 - SupportoBullo1 : &#128514; &#128514;","‎28 / 04 / 18 , 14 : 29 - SupportoBullo1 : &#128514; &#128514;","28 / 04 / 18 , 14 : 29", - SupportoBullo1 , &#128514; &#128514;,- SupportoBullo1,😂 😂,- SupportoBullo1, 
C_1,54,"‎28 / 04 / 18 , 14 : 29 - Vittima : comunque io ho parlato con mia madre e mi ha detto che ha solo suggerito di fare un po' più di compiti perché effettivamente non si studia molto","‎28 / 04 / 18 , 14 : 29 - Vittima : Anyway I talked to my mom and she told me that she only suggested that we should do a little more homework because we actually do not study much","28 / 04 / 18 , 14 : 29", - Vittima , Anyway I talked to my mom and she told me that she only suggested that we should do a little more homework because we actually do not study much,- Vittima,Anyway I talked to my mom and she told me that she only suggested that we should do a little more homework because we actually do not study much,- Vittima,Anyway I talked to my mom and she told me that she only suggested that we should do a little more homework because we actually do not study much
C_1,55,"‎28 / 04 / 18 , 14 : 29 - SupportoVittima1 : NON SONO LA SUA RAGAZZAAAAAAAA","‎28 / 04 / 18 , 14 : 29 - SupportoVittima1 : I'M NOT HIS GIRLFRIEND.","28 / 04 / 18 , 14 : 29", - SupportoVittima1 , I'M NOT HIS GIRLFRIEND.,- SupportoVittima1,I'M NOT HIS GIRLFRIEND.,- SupportoVittima1,I'M NOT HIS GIRLFRIEND.
C_1,56,"‎28 / 04 / 18 , 14 : 29 - Bullo2 : Ma studi tutto il giorno mina ?","‎28 / 04 / 18 , 14 : 29 - Bullo2 : Do you study all day bitch?","28 / 04 / 18 , 14 : 29", - Bullo2 , Do you study all day bitch?,- Bullo2,Do you study all day bitch?,- Bullo2,Do you study all day bitch?
C_1,57,"‎28 / 04 / 18 , 14 : 29 - Vittima : e io faccio sempre roba aggiuntiva","‎28 / 04 / 18 , 14 : 29 - Vittima : I'm always doing extra stuff.","28 / 04 / 18 , 14 : 29", - Vittima , I'm always doing extra stuff.,- Vittima,I'm always doing extra stuff.,- Vittima,I'm always doing extra stuff.
C_1,58,"‎28 / 04 / 18 , 14 : 29 - Bullo2 : Mona*","‎28 / 04 / 18 , 14 : 29 - Bullo2 : Bitch!","28 / 04 / 18 , 14 : 29", - Bullo2 , Bitch!,- Bullo2,Bitch!,- Bullo2,Bitch!
C_1,59,"‎28 / 04 / 18 , 14 : 30 - SupportoBullo1 : Dato che non hai regole vai da tua madre e mandala a fanculo se è stata lei","‎28 / 04 / 18 , 14 : 30 - SupportoBullo1 : Since you don't have any rules, go to your mother and tell her to fuck off, if it was her!","28 / 04 / 18 , 14 : 30", - SupportoBullo1 ," Since you don't have any rules, go to your mother and tell her to fuck off, if it was her!",- SupportoBullo1,"Since you don't have any rules, go to your mother and tell her to fuck off, if it was her!",- SupportoBullo1,"Since you don't have any rules, go to your mother and tell her to fuck off, if it was her!"
C_1,60,"‎28 / 04 / 18 , 14 : 30 - Vittima : che c'è di male se studio ?","‎28 / 04 / 18 , 14 : 30 - Vittima : What's wrong with studying?","28 / 04 / 18 , 14 : 30", - Vittima , What's wrong with studying?,- Vittima,What's wrong with studying?,- Vittima,What's wrong with studying?
C_1,61,"‎28 / 04 / 18 , 14 : 30 - Bullo2 : Ma sei ritardato forte fra","‎28 / 04 / 18 , 14 : 30 - Bullo2 : But you are deeply retarded, bro","28 / 04 / 18 , 14 : 30", - Bullo2 ," But you are deeply retarded, bro",- Bullo2,"But you are deeply retarded, bro",- Bullo2,"But you are deeply retarded, bro"
C_1,62,"‎28 / 04 / 18 , 14 : 30 - Vittima : io a mia madre non dico proprio nulla","‎28 / 04 / 18 , 14 : 30 - Vittima : I say  nothing at all to my mother","28 / 04 / 18 , 14 : 30", - Vittima , I say  nothing at all to my mother,- Vittima,I say nothing at all to my mother,- Vittima,I say nothing at all to my mother
C_1,63,"‎28 / 04 / 18 , 14 : 30 - Vittima : chi sei tu per dirmi cosa devo dirle=","‎28 / 04 / 18 , 14 : 30 - Vittima : who are you to tell me what to tell her=","28 / 04 / 18 , 14 : 30", - Vittima , who are you to tell me what to tell her=,- Vittima,who are you to tell me what to tell her=,- Vittima,who are you to tell me what to tell her=
C_1,64,"‎28 / 04 / 18 , 14 : 30 - SupportoBullo3 : Cosa ma sei tutto fatto coglione","‎28 / 04 / 18 , 14 : 30 - SupportoBullo3 : What? you're a stoned asshole","28 / 04 / 18 , 14 : 30", - SupportoBullo3 , What? you're a stoned asshole,- SupportoBullo3,What? you're a stoned asshole,- SupportoBullo3,What? you're a stoned asshole
C_1,65,"‎28 / 04 / 18 , 14 : 30 - SupportoBullo3 : Hahaha proprio deficente","‎28 / 04 / 18 , 14 : 30 - SupportoBullo3 : Hahaha you're such a dork","28 / 04 / 18 , 14 : 30", - SupportoBullo3 , Hahaha you're such a dork,- SupportoBullo3,Hahaha you're such a dork,- SupportoBullo3,Hahaha you're such a dork
C_1,66,"‎28 / 04 / 18 , 14 : 30 - Bullo2 : Si tu studia fai quel cazzo che vuoi ma di a tua madre a quella p . . . . Di non dire più un cazzo ai professori che già abbiamo troppi compiti","‎28 / 04 / 18 , 14 : 30 - Bullo2 : Yes, study, do what the fuck you want but tell your mother that b . . . . Not to tell the teachers anything, we already have too much homework.","28 / 04 / 18 , 14 : 30", - Bullo2 ," Yes, study, do what the fuck you want but tell your mother that b . . . . Not to tell the teachers anything, we already have too much homework.",- Bullo2,"Yes, study, do what the fuck you want but tell your mother that b . . . . Not to tell the teachers anything, we already have too much homework.",- Bullo2,"Yes, study, do what the fuck you want but tell your mother that b . . . . Not to tell the teachers anything, we already have too much homework."
C_1,67,"‎28 / 04 / 18 , 14 : 31 - SupportoBullo1 : Qualcuno perché , per colpa sua ora siamo qui a fare compiti su compiti &#128545;","‎28 / 04 / 18 , 14 : 31 - SupportoBullo1 : Someone because, because of him we are now here doing homework after homework &#128545;","28 / 04 / 18 , 14 : 31", - SupportoBullo1 ," Someone because, because of him we are now here doing homework after homework &#128545;",- SupportoBullo1,"Someone because, because of him we are now here doing homework after homework 😡",- SupportoBullo1,"Someone because, because of him we are now here doing homework after homework "
C_1,68,"‎28 / 04 / 18 , 14 : 31 - Bullo2 : Già","‎28 / 04 / 18 , 14 : 31 - Bullo2 : Yep","28 / 04 / 18 , 14 : 31", - Bullo2 , Yep,- Bullo2,Yep,- Bullo2,Yep
C_1,69,"‎28 / 04 / 18 , 14 : 31 - SupportoVittima1 : Ma tanto non li fate lostesso i compiti quindi non vi cambia niente","‎28 / 04 / 18 , 14 : 31 - SupportoVittima1 : But you don't do your homework anyway, so it doesn't change anything.","28 / 04 / 18 , 14 : 31", - SupportoVittima1 ," But you don't do your homework anyway, so it doesn't change anything.",- SupportoVittima1,"But you don't do your homework anyway, so it doesn't change anything.",- SupportoVittima1,"But you don't do your homework anyway, so it doesn't change anything."
